{
  "schema_version": 1,
  "name": "vast-titan",
  "description": "The 2x Titan RTX Vast.ai campaign: rent, stage, run the Strata matrix, pull, destroy.",
  "backend": "vast",
  "runner": "cloud",
  "model": "strata-packs",
  "experiment": "2026-10-25-vast-titanx2",
  "evidence": ["strata-runs/2026-10-25-vast-titanx2"],
  "hardware": {
    "kind": "cloud",
    "offer": {
      "gpu_name": "Titan RTX",
      "num_gpus": 2,
      "min_ram_gb": 120,
      "min_disk_gb": 150,
      "min_driver": "580.65",
      "max_down_cost_per_tb": 5.0,
      "min_reliability": 0.97,
      "max_dph": 0.5,
      "model_gb": 113.2,
      "hours": 2.7,
      "image": "vastai/base-image:cuda-13.0.1-auto",
      "disk_gb": 160
    }
  },
  "mode": "cloud",
  "options": {
    "flow": "plan",
    "packs": "iq3s coder",
    "setup_script": "setup.sh"
  },
  "output": {"root": "logs", "subdir": "{name}-{stamp}"},
  "estimate": {
    "wall_minutes": 165,
    "cost_usd": 1.19,
    "basis": "2026-10-25 instance 57698991: 2.7 billed hours, $1.192 total at $0.311/h plus download"
  },
  "caveats": [
    "The historical host cost $0.311/h and $2.67/TB downloaded; the offer filter here rejects any host above $5/TB because a $53/TB host burned $3.80 on 73 GB.",
    "The 131072 C=4 and 262144 C>=2 cells are skipped-infeasible: prefill ~1.5k tok/s and four concurrent prefills do not overlap four times.",
    "Instance 57698991 was destroyed after the pull (DELETE success, list total 0); always run `benchctl vast destroy --instance ID --yes`.",
    "The 2026-10-25 probe was the one-point calibration build and produced ~9% short prompts at >=131k; bench/probe.py is the two-point canonical version.",
    "Vast /api/v0/instances/ is deprecated (301): list on /api/v1/instances/, create on PUT /api/v0/asks/{offer}/, destroy on DELETE /api/v0/instances/{id}/."
  ]
}
