{
  "schema_version": 1,
  "name": "strata-v100-kv-dtypes-262k",
  "description": "KV dtype comparison at the 262k window on the resident 4x V100-32G IQ3_S server: int8 baseline vs q4_0 vs k8v4, C1 128-token answers.",
  "backend": "strata",
  "runner": "knobs",
  "model": "iq3s",
  "experiment": "2026-10-27-v100-extras",
  "evidence": [],
  "hardware": {
    "kind": "cluster",
    "partition": "ffa-gpulab",
    "nodelist": "volta05",
    "gres": "gpu:4",
    "cpus": 32,
    "mem": "340G",
    "time": "11:00:00",
    "gpus": "0,1,2,3",
    "gpu_type": "4x V100-SXM2-32GB"
  },
  "mode": "knobs",
  "options": {
    "contexts": "262144",
    "batches": "1",
    "variants": "basefull,kvq4_0,kvk8v4"
  },
  "probe": {
    "max_context": 262144,
    "max_tokens": 128,
    "requests_per_slot": 3,
    "pad_safety": 128
  },
  "budget_min": 35,
  "output": {"root": "strata_runs", "subdir": "2026-10-27-v100-extras/m7-kv-262k"},
  "estimate": {
    "wall_minutes": 25,
    "basis": "three variant launches (about 5 min each) plus 3 x 72 s prefill per variant"
  },
  "caveats": [
    "NEW DEFINITION, first run 2026-10-27. The engine may refuse a dtype at 262k; the sweep records the real launch error.",
    "q4_0 and k8v4 trade precision for KV size; this measures speed only, not quality.",
    "`basefull` is the int8 baseline at the same window and is the control for the two dtypes."
  ]
}
