{
  "schema_version": 1,
  "name": "strata-v100-resident-2x-iq3s",
  "description": "IQ3_S on two V100-32G cards (volta05): does 54.8 GB of experts plus dense/KV stay fully resident in 64 GB, and what does the 2x vs 4x crossover look like at 1k-128k?",
  "backend": "strata",
  "runner": "matrix",
  "model": "iq3s",
  "experiment": "2026-10-27-v100-extras",
  "evidence": [],
  "hardware": {
    "kind": "cluster",
    "partition": "ffa-gpulab",
    "nodelist": "volta05",
    "gres": "gpu:2",
    "cpus": 24,
    "mem": "200G",
    "time": "11:00:00",
    "gpus": "0,1",
    "gpu_type": "2x V100-SXM2-32GB"
  },
  "mode": "cold",
  "cells": [
    "1024:1", "1024:2",
    "4096:1", "4096:2",
    "16384:1", "16384:2",
    "65536:1", "65536:2",
    "131072:1", "131072:2"
  ],
  "probe": {
    "max_context": 131072,
    "max_tokens": 128,
    "requests_per_slot": 3,
    "pad_safety": 128
  },
  "budget_min": 45,
  "output": {"root": "strata_runs", "subdir": "2026-10-27-v100-extras/h4-2x-iq3s"},
  "estimate": {
    "wall_minutes": 25,
    "basis": "two-card load plus ten cells; prefill at 128k dominates (about 3 x 50 s)"
  },
  "caveats": [
    "NEW DEFINITION, first run 2026-10-27. It must prove residency from the engine log (`100% of the experts resident`, `N of N profiled pairs`); if it streams, that is the crossover result, not a failed run.",
    "The matrix runner uses --batch 2 for a C1/C2 ladder, while the 4x resident recipe used --batch 4; per-stream decode is not directly comparable across the two server shapes.",
    "One allocation must own cards 0 and 1; the node is shared.",
    "128k is the top of this ladder; 262k on 2x is not attempted (64 GB cannot hold the pack plus the 262k KV comfortably)."
  ]
}
