{
  "schema_version": 1,
  "name": "qwen38-bw-fp4",
  "description": "Qwen3.8-Flash-Next FP4 measurement matrix against the 2x BW6000 vLLM container server.",
  "backend": "vllm",
  "runner": "measure",
  "model": "qwen38-flash-next-fp4-local",
  "experiment": "2026-10-24-qwen38-bw-results",
  "evidence": ["repo:llm/qwen38/experiments/data/2026-10-24-qwen38-bw"],
  "hardware": {
    "kind": "cluster",
    "partition": "ffa-preempt",
    "nodelist": "bw01",
    "gres": "gpu:2",
    "cpus": 8,
    "mem": "220G",
    "time": "36:00:00",
    "gpus": "0,1",
    "gpu_type": "2x BW6000 96GB"
  },
  "mode": "measure",
  "options": {
    "flavour": "qwen38",
    "base_url": "http://bw01:8010",
    "served_model": "qwen38-flash-next"
  },
  "output": {"root": "results", "subdir": "{name}-{stamp}"},
  "estimate": {
    "wall_minutes": 30,
    "basis": "2026-10-24 measure run against an already-loaded server"
  },
  "caveats": [
    "measure.sh measures a server that is already up; it does not start one. Run `benchctl run --recipe qwen38-bw-fp4` only after serve.sh reports ready.",
    "Resources in the recipe are informational: llm/qwen38/config-bw.json is the source of truth for the Slurm job.",
    "The FP4 checkpoint is a local site artifact; a stock vLLM cannot load its compressed NVFP4 scales, hence the pinned community container.",
    "The first boot pays a 43-minute JIT/autotune; later starts reuse cache/qwen38.",
    "The context ladder at 256K is prefill-dominated with 128-token answers; prefix-cache numbers use the paged probe, not this bench client."
  ]
}
